gemm_tuning_results/dit_2564.csv
Validator,PT_VERSION,2.5.1
Validator,ROCM_VERSION,6.3.0.2.0-4-ce2be3b
Validator,HIPBLASLT_VERSION,1000-9f30df55
Validator,GCN_ARCH_NAME,gfx942:sramecc+:xnack-
Validator,ROCBLAS_VERSION,4.3.0-8ebd6c11
GemmAndBiasTunableOp_BFloat16_NT,nt_1152_1152_32,Gemm_Hipblaslt_NT_163346,0.0201977
GemmAndBiasTunableOp_BFloat16_NT,nt_1152_6912_32,Gemm_Hipblaslt_NT_165262,0.0249674
GemmAndBiasTunableOp_BFloat16_NT,nt_256_1152_32,Gemm_Hipblaslt_NT_163346,0.0205397
GemmAndBiasTunableOp_BFloat16_NT,nt_1152_1152_8192,Gemm_Hipblaslt_NT_190109,0.160256
GemmAndBiasTunableOp_BFloat16_NT,nt_1152_4608_8192,Gemm_Hipblaslt_NT_191035,0.529669
GemmAndBiasTunableOp_BFloat16_NT,nt_1152_3456_8192,Gemm_Hipblaslt_NT_163342,0.424804
GemmAndBiasTunableOp_BFloat16_NT,nt_1152_2304_32,Gemm_Hipblaslt_NT_163347,0.0186581
GemmAndBiasTunableOp_BFloat16_NT,nt_4608_1152_8192,Gemm_Hipblaslt_NT_189882,0.52622
GemmAndBiasTunableOp_BFloat16_NT,nt_1152_32_8192,Gemm_Hipblaslt_NT_188637,0.0253685
GemmAndBiasTunableOp_BFloat16_TN,tn_2304_32_1152,Gemm_Hipblaslt_TN_136342,0.0197357
GemmAndBiasTunableOp_BFloat16_TN,tn_1152_8192_4608,Gemm_Hipblaslt_TN_226743,0.471469
GemmAndBiasTunableOp_BFloat16_TN,tn_4608_8192_1152,Gemm_Hipblaslt_TN_227916,0.482014
GemmAndBiasTunableOp_BFloat16_TN,tn_32_8192_1152,Gemm_Hipblaslt_TN_139367,0.0198929
GemmAndBiasTunableOp_BFloat16_TN,tn_1152_8192_1152,Gemm_Hipblaslt_TN_226501,0.134986
GemmAndBiasTunableOp_BFloat16_TN,tn_3456_8192_1152,Gemm_Hipblaslt_TN_227846,0.3692
GemmAndBiasTunableOp_BFloat16_TN,tn_6912_32_1152,Gemm_Hipblaslt_TN_137498,0.0193409
GemmAndBiasTunableOp_BFloat16_TN,tn_1152_32_1152,Gemm_Hipblaslt_TN_136975,0.0189805
GemmAndBiasTunableOp_BFloat16_TN,tn_1152_32_256,Gemm_Hipblaslt_TN_136173,0.0177957
GemmAndBiasTunableOp_BFloat16_NN,nn_1152_32_6912,Gemm_Hipblaslt_NN_145087,0.0245613
GemmAndBiasTunableOp_BFloat16_NN,nn_1152_8192_1152,Gemm_Hipblaslt_NN_164352,0.14176
GemmAndBiasTunableOp_BFloat16_NN,nn_1152_32_1152,Gemm_Hipblaslt_NN_165503,0.0204061
GemmAndBiasTunableOp_BFloat16_NN,nn_1152_8192_4608,Gemm_Hipblaslt_NN_193596,0.478073
GemmAndBiasTunableOp_BFloat16_NN,nn_1152_8192_3456,Gemm_Hipblaslt_NN_193040,0.360617
GemmAndBiasTunableOp_BFloat16_NN,nn_4608_8192_1152,Gemm_Hipblaslt_NN_165465,0.47546
GemmAndBiasTunableOp_BFloat16_NN,nn_1152_32_2304,Gemm_Hipblaslt_NN_143120,0.0187241
GemmAndBiasTunableOp_BFloat16_NN,nn_1152_8192_32,Gemm_Hipblaslt_NN_193876,0.0294497
GemmTunableOp_BFloat16_NT,nt_1152_32_8192,Gemm_Hipblaslt_NT_189095,0.0258289
GemmTunableOp_BFloat16_NT,nt_4608_1152_8192,Gemm_Hipblaslt_NT_189879,0.526131
GemmTunableOp_BFloat16_NT,nt_1152_2304_32,Gemm_Rocblas_621287646,0.0138085
GemmTunableOp_BFloat16_NT,nt_1152_3456_8192,Gemm_Hipblaslt_NT_163342,0.424375
GemmTunableOp_BFloat16_NT,nt_1152_4608_8192,Gemm_Hipblaslt_NT_189724,0.53061
GemmTunableOp_BFloat16_NT,nt_1152_1152_8192,Gemm_Hipblaslt_NT_190109,0.160732
GemmTunableOp_BFloat16_NT,nt_256_1152_32,Gemm_Rocblas_621287597,0.0117577
GemmTunableOp_BFloat16_NT,nt_1152_6912_32,Gemm_Rocblas_621293816,0.0228541
GemmTunableOp_BFloat16_NT,nt_1152_1152_32,Gemm_Rocblas_621293817,0.0118232
GemmTunableOp_BFloat16_NN,nn_1152_8192_32,Gemm_Hipblaslt_NN_193876,0.0295077
GemmTunableOp_BFloat16_NN,nn_1152_32_2304,Gemm_Rocblas_621291089,0.0174449
GemmTunableOp_BFloat16_NN,nn_4608_8192_1152,Gemm_Rocblas_621296094,0.463291
GemmTunableOp_BFloat16_NN,nn_1152_8192_3456,Gemm_Hipblaslt_NN_193040,0.362903
GemmTunableOp_BFloat16_NN,nn_1152_8192_4608,Gemm_Rocblas_621291002,0.471091
GemmTunableOp_BFloat16_NN,nn_1152_32_1152,Gemm_Rocblas_621291096,0.0126325
GemmTunableOp_BFloat16_NN,nn_1152_8192_1152,Gemm_Rocblas_621291000,0.139951
GemmTunableOp_BFloat16_NN,nn_1152_32_6912,Gemm_Rocblas_621296161,0.0190285
GemmTunableOp_BFloat16_TN,tn_1152_32_256,Gemm_Rocblas_621289384,0.00984086
GemmTunableOp_BFloat16_TN,tn_1152_32_1152,Gemm_Rocblas_621295356,0.0109869
GemmTunableOp_BFloat16_TN,tn_6912_32_1152,Gemm_Rocblas_621295374,0.0173017
GemmTunableOp_BFloat16_TN,tn_3456_8192_1152,Gemm_Hipblaslt_TN_165614,0.365301
GemmTunableOp_BFloat16_TN,tn_1152_8192_1152,Gemm_Hipblaslt_TN_165614,0.139662
GemmTunableOp_BFloat16_TN,tn_32_8192_1152,Gemm_Hipblaslt_TN_226758,0.0201357
GemmTunableOp_BFloat16_TN,tn_4608_8192_1152,Gemm_Rocblas_621295417,0.495708
GemmTunableOp_BFloat16_TN,tn_1152_8192_4608,Gemm_Rocblas_621289219,0.47399
GemmTunableOp_BFloat16_TN,tn_2304_32_1152,Gemm_Rocblas_621295374,0.0119756
