gemm_tuning_results/profiling_dit_2565.csv
Validator,PT_VERSION,2.5.1
Validator,ROCM_VERSION,6.3.0.2.0-4-ce2be3b
Validator,HIPBLASLT_VERSION,1000-9f30df55
Validator,GCN_ARCH_NAME,gfx942:sramecc+:xnack-
Validator,ROCBLAS_VERSION,4.3.0-8ebd6c11
GemmAndBiasTunableOp_BFloat16_NT,nt_1152_1152_32,Gemm_Hipblaslt_NT_163345,0.0202089
GemmAndBiasTunableOp_BFloat16_NT,nt_1152_6912_32,Gemm_Hipblaslt_NT_165262,0.0250778
GemmAndBiasTunableOp_BFloat16_NT,nt_256_1152_32,Gemm_Hipblaslt_NT_163351,0.0203825
GemmAndBiasTunableOp_BFloat16_NT,nt_1152_1152_8192,Gemm_Hipblaslt_NT_190109,0.160224
GemmAndBiasTunableOp_BFloat16_NT,nt_1152_4608_8192,Gemm_Hipblaslt_NT_191035,0.529914
GemmAndBiasTunableOp_BFloat16_NT,nt_1152_3456_8192,Gemm_Hipblaslt_NT_163342,0.424272
GemmAndBiasTunableOp_BFloat16_NT,nt_1152_2304_32,Gemm_Hipblaslt_NT_163347,0.0188373
GemmAndBiasTunableOp_BFloat16_NT,nt_4608_1152_8192,Gemm_Hipblaslt_NT_189879,0.525871
GemmAndBiasTunableOp_BFloat16_NT,nt_1152_32_8192,Gemm_Hipblaslt_NT_188637,0.025389
GemmAndBiasTunableOp_BFloat16_NN,nn_1152_32_6912,Gemm_Hipblaslt_NN_147901,0.0238241
GemmAndBiasTunableOp_BFloat16_NN,nn_1152_8192_1152,Gemm_Hipblaslt_NN_164352,0.141839
GemmAndBiasTunableOp_BFloat16_NN,nn_1152_32_1152,Gemm_Hipblaslt_NN_165499,0.0205101
GemmAndBiasTunableOp_BFloat16_NN,nn_1152_8192_4608,Gemm_Hipblaslt_NN_193312,0.477222
GemmAndBiasTunableOp_BFloat16_NN,nn_1152_8192_3456,Gemm_Hipblaslt_NN_193040,0.360276
GemmAndBiasTunableOp_BFloat16_NN,nn_4608_8192_1152,Gemm_Hipblaslt_NN_165469,0.475892
GemmAndBiasTunableOp_BFloat16_NN,nn_1152_32_2304,Gemm_Hipblaslt_NN_143119,0.0187857
GemmAndBiasTunableOp_BFloat16_NN,nn_1152_8192_32,Gemm_Hipblaslt_NN_193876,0.0295202
GemmAndBiasTunableOp_BFloat16_TN,tn_2304_32_1152,Gemm_Hipblaslt_TN_136352,0.0196609
GemmAndBiasTunableOp_BFloat16_TN,tn_1152_8192_4608,Gemm_Hipblaslt_TN_226743,0.471723
GemmAndBiasTunableOp_BFloat16_TN,tn_4608_8192_1152,Gemm_Hipblaslt_TN_227916,0.481704
GemmAndBiasTunableOp_BFloat16_TN,tn_32_8192_1152,Gemm_Hipblaslt_TN_226350,0.0201449
GemmAndBiasTunableOp_BFloat16_TN,tn_1152_8192_1152,Gemm_Hipblaslt_TN_226501,0.134808
GemmAndBiasTunableOp_BFloat16_TN,tn_3456_8192_1152,Gemm_Hipblaslt_TN_227846,0.36875
GemmAndBiasTunableOp_BFloat16_TN,tn_6912_32_1152,Gemm_Hipblaslt_TN_136535,0.0193209
GemmAndBiasTunableOp_BFloat16_TN,tn_1152_32_1152,Gemm_Hipblaslt_TN_137391,0.0188341
GemmAndBiasTunableOp_BFloat16_TN,tn_1152_32_256,Gemm_Hipblaslt_TN_136182,0.0170937
