gemm_tuning_results/profiling_dit_2560.csv
Validator,PT_VERSION,2.5.1
Validator,ROCM_VERSION,6.3.0.2.0-4-ce2be3b
Validator,HIPBLASLT_VERSION,1000-9f30df55
Validator,GCN_ARCH_NAME,gfx942:sramecc+:xnack-
Validator,ROCBLAS_VERSION,4.3.0-8ebd6c11
GemmAndBiasTunableOp_BFloat16_NT,nt_1152_1152_32,Gemm_Hipblaslt_NT_163351,0.0202061
GemmAndBiasTunableOp_BFloat16_NT,nt_1152_6912_32,Gemm_Hipblaslt_NT_165262,0.0250722
GemmAndBiasTunableOp_BFloat16_NT,nt_256_1152_32,Gemm_Hipblaslt_NT_163344,0.0202097
GemmAndBiasTunableOp_BFloat16_NT,nt_1152_1152_8192,Gemm_Hipblaslt_NT_190109,0.160287
GemmAndBiasTunableOp_BFloat16_NT,nt_1152_4608_8192,Gemm_Hipblaslt_NT_191035,0.52936
GemmAndBiasTunableOp_BFloat16_NT,nt_1152_3456_8192,Gemm_Hipblaslt_NT_163342,0.424035
GemmAndBiasTunableOp_BFloat16_NT,nt_1152_2304_32,Gemm_Hipblaslt_NT_163347,0.0189193
GemmAndBiasTunableOp_BFloat16_NT,nt_4608_1152_8192,Gemm_Hipblaslt_NT_189879,0.526195
GemmAndBiasTunableOp_BFloat16_NT,nt_1152_32_8192,Gemm_Hipblaslt_NT_188637,0.0254314
GemmAndBiasTunableOp_BFloat16_NN,nn_1152_32_6912,Gemm_Hipblaslt_NN_147901,0.023897
GemmAndBiasTunableOp_BFloat16_NN,nn_1152_8192_1152,Gemm_Hipblaslt_NN_164352,0.141663
GemmAndBiasTunableOp_BFloat16_NN,nn_1152_32_1152,Gemm_Hipblaslt_NN_165501,0.0206437
GemmAndBiasTunableOp_BFloat16_NN,nn_1152_8192_4608,Gemm_Hipblaslt_NN_193735,0.477593
GemmAndBiasTunableOp_BFloat16_NN,nn_1152_8192_3456,Gemm_Hipblaslt_NN_193040,0.360207
GemmAndBiasTunableOp_BFloat16_NN,nn_4608_8192_1152,Gemm_Hipblaslt_NN_165465,0.475857
GemmAndBiasTunableOp_BFloat16_NN,nn_1152_32_2304,Gemm_Hipblaslt_NN_143120,0.0188593
GemmAndBiasTunableOp_BFloat16_NN,nn_1152_8192_32,Gemm_Hipblaslt_NN_193876,0.0294134
GemmAndBiasTunableOp_BFloat16_TN,tn_2304_32_1152,Gemm_Hipblaslt_TN_136363,0.0197445
GemmAndBiasTunableOp_BFloat16_TN,tn_1152_8192_4608,Gemm_Hipblaslt_TN_226743,0.470735
GemmAndBiasTunableOp_BFloat16_TN,tn_4608_8192_1152,Gemm_Hipblaslt_TN_227916,0.48155
GemmAndBiasTunableOp_BFloat16_TN,tn_32_8192_1152,Gemm_Hipblaslt_TN_226350,0.0199161
GemmAndBiasTunableOp_BFloat16_TN,tn_1152_8192_1152,Gemm_Hipblaslt_TN_226501,0.134799
GemmAndBiasTunableOp_BFloat16_TN,tn_3456_8192_1152,Gemm_Hipblaslt_TN_227846,0.368626
GemmAndBiasTunableOp_BFloat16_TN,tn_6912_32_1152,Gemm_Hipblaslt_TN_137498,0.0191313
GemmAndBiasTunableOp_BFloat16_TN,tn_1152_32_1152,Gemm_Hipblaslt_TN_136188,0.0186925
GemmAndBiasTunableOp_BFloat16_TN,tn_1152_32_256,Gemm_Hipblaslt_TN_139366,0.0182437
